{
  "schema_version": 1,
  "run_id": "20260826T153012Z-superpowers-sync-7fd2",
  "project_id": "advanced-ai-workflows",
  "task_id": "phase-01-loop-02-todo-03",
  "title": "Port AAW routing intent onto Superpowers v6.3.0",
  "kind": "implementation",
  "duration": "long",
  "isolation": "worktree",
  "provider": "codex",
  "manager": "herdr",
  "repository": "C:/src/superpowers",
  "base_ref": "upstream/main",
  "base_sha": "b36e0829c6d0140e93cfef2ca599b1b07d4a7797",
  "branch": "sync/upstream-2026-08-26",
  "allowed_paths": ["skills/brainstorming/", "skills/using-superpowers/", "tests/"],
  "forbidden_paths": [".advanced-plans/state/"],
  "spec_paths": [".advanced-plans/specs/2026-08-26-herdr-multi-runtime-orchestration-design.md"],
  "acceptance_checks": ["package test command", "AAW routing fixture tests"],
  "required_evidence": ["git_diff", "tests", "agent_summary", "review"],
  "created_at": "2026-08-26T15:30:12Z"
}
